{
  "id": "user-research/default",
  "conversationType": "user_research",
  "industry": "any",
  "title": "ユーザー調査インタビュー",
  "description": "行動事実、頻度、代替手段、具体例、課題の深さ、価値仮説の聞き漏れを減らす。",
  "mustCheck": [
    "直近の具体的な利用・作業シーン",
    "発生頻度、関係者、所要時間、作業量",
    "現在の代替手段、既存ツール、手作業、回避策",
    "最後に困った具体例と、そのときの行動",
    "失敗時の影響、後工程、コスト、リスク",
    "判断基準、優先順位、妥協できる条件",
    "切替意欲、支払い意欲、導入障壁",
    "理想状態と、それが満たされたと判断する条件"
  ],
  "signals": [
    "週に何度もあります",
    "今はスプレッドシートで代替しています",
    "更新漏れがよくあります",
    "最後に困ったのは",
    "判断基準は人によって違う",
    "失敗すると後工程でやり直しになります",
    "理想は確認しなくても状態が分かること",
    "手作業で合わせています",
    "誰かに確認しています",
    "古い情報を見てしまいました",
    "時間がある時だけやっています",
    "本当はやりたくない作業です"
  ],
  "ambiguousTerms": [
    "よくある",
    "たまに",
    "面倒",
    "使いやすい",
    "困る",
    "ざっくり",
    "理想",
    "必要"
  ],
  "goodQuestions": [
    "最後にその作業をしたのはいつですか？",
    "その時、最初に何を見て、次に何をしましたか？",
    "その作業はどのくらいの頻度で起きますか？",
    "今は何で代替していますか？",
    "最後に困った具体例を教えてもらえますか？",
    "その問題が起きると、誰にどんな影響がありますか？",
    "その回避策にはどのくらい時間や手間がかかっていますか？",
    "今の方法で問題ない点と、限界を感じる点は何ですか？",
    "もし切り替えるなら、何が満たされている必要がありますか？",
    "理想状態になったかどうかは、何を見れば判断できますか？"
  ],
  "avoid": [
    "欲しい機能を直接聞いて行動事実を確認しない",
    "誘導質問で仮説に同意させる",
    "頻度や影響を聞かずに課題が大きいと判断する",
    "将来の希望だけで過去の具体例を聞かない",
    "使いやすいなどの抽象語を定義せずに進める",
    "支払い意欲や切替障壁を聞かずに価値があると判断する"
  ],
  "completionCriteria": [
    "直近の具体的な行動事実が説明されている",
    "頻度、所要時間、関係者、影響範囲が確認できている",
    "現在の代替手段と不満点が確認できている",
    "最後に困った具体例とその時の対応が確認できている",
    "課題の影響が後工程、コスト、リスクで説明できる",
    "判断基準と妥協できない条件が整理されている",
    "切替意欲または支払い意欲の根拠がある",
    "理想状態と達成判定条件が確認できている"
  ],
  "cardRules": [
    "1カード1質問にする",
    "意見より直近の行動事実を優先して聞く",
    "抽象語が出たら頻度、具体例、影響に分解する",
    "誘導せず、相手の言葉で説明してもらう",
    "代替手段が出たら手間、満足点、不満点を確認する",
    "課題が出たら切替条件または支払い意欲を確認する"
  ]
}
