{
  "id": "sales/default",
  "conversationType": "sales",
  "industry": "any",
  "title": "商談ヒアリング",
  "description": "顧客課題、意思決定、予算、導入時期、競合比較、次アクションの聞き漏れを減らす。",
  "mustCheck": [
    "今回の商談で相手が達成したいこと",
    "現状の課題、困っている業務、発生している損失",
    "課題が発生している頻度、規模、影響範囲",
    "現在の代替手段、既存ツール、運用フロー",
    "意思決定者、利用者、影響を受ける部門",
    "導入判断の基準、比較対象、懸念点",
    "予算感、導入時期、社内稟議プロセス",
    "次回アクション、担当者、期限"
  ],
  "signals": [
    "今は手作業でやっています",
    "属人化しています",
    "時間がかかっています",
    "ミスが起きています",
    "他社も見ています",
    "上司に確認します",
    "予算はまだ決まっていません",
    "急ぎではないです",
    "現場が使うか不安です",
    "セキュリティが気になります",
    "費用対効果を説明したい",
    "まずは小さく試したいです"
  ],
  "ambiguousTerms": [
    "効率化",
    "コスト削減",
    "使いやすい",
    "早めに",
    "前向き",
    "検討します",
    "高い",
    "社内調整"
  ],
  "goodQuestions": [
    "今回の検討が始まった一番のきっかけは何ですか？",
    "その課題は、今どの業務や数字に一番影響していますか？",
    "今はその課題をどのような方法で回避・対応していますか？",
    "導入判断で最も重視される条件は何ですか？",
    "最終的な導入判断には、どなたが関わりますか？",
    "予算はすでに確保済みですか、それともこれから申請される段階ですか？",
    "いつ頃までに判断、または運用開始できているのが理想ですか？",
    "他に比較しているサービスや、内製・現状維持の選択肢はありますか？",
    "社内で反対や懸念が出るとしたら、どの点になりそうですか？",
    "次回までにこちらから用意すると判断しやすい材料は何ですか？"
  ],
  "avoid": [
    "相手の課題を確認する前に機能説明を長く続ける",
    "曖昧な言葉を深掘りせず流す",
    "決裁者、予算、時期を聞かずに商談を終える",
    "価格反応に即値引き誘導する",
    "顧客発言の要約だけをカード化する",
    "次回アクションを担当者と期限なしで終える"
  ],
  "completionCriteria": [
    "顧客課題と業務影響が1文で説明できる",
    "現在の代替手段と不満点が確認できている",
    "意思決定者、利用者、推進者の少なくとも一部が特定できている",
    "判断基準と懸念点が確認できている",
    "予算または稟議プロセスの状態が確認できている",
    "導入希望時期または検討スケジュールが確認できている",
    "比較対象または現状維持との比較軸が確認できている",
    "次回アクション、担当者、期限が合意されている"
  ],
  "cardRules": [
    "1カード1質問にする",
    "直近発言に含まれる曖昧語やリスク信号を優先して出す",
    "議事録要約ではなく次に聞くべき質問だけを出す",
    "既に確認済みの内容は再提示しない",
    "商談終盤では次回アクション確認カードを優先する",
    "強い購買シグナル時のみ最大3枚まで表示する"
  ]
}
