{
  "id": "sales/manufacturing",
  "conversationType": "sales",
  "industry": "manufacturing",
  "title": "製造業向け商談ヒアリング",
  "description": "製造現場の品質、既存システム、現場定着、稟議、導入障壁を中心に聞き漏れを減らす。",
  "mustCheck": [
    "現場の困りごとと品質・納期・工数への影響",
    "現在の設備、既存システム、手作業、Excel運用",
    "利用部門、情報システム部、工場長、決裁者の関係",
    "稟議・承認プロセスの段階と必要書類",
    "確保済み予算か、これから申請する予算か",
    "導入希望時期と、その期限が動かせるか",
    "現場定着を阻む教育、操作、責任範囲の懸念",
    "失注・延期につながる条件"
  ],
  "signals": [
    "現場の入力作業が多い",
    "品質確認に時間がかかっています",
    "既存システムとの連携ができれば",
    "情報システム部に確認が必要です",
    "工場長が関わります",
    "現場が使えるか不安です",
    "導入工数が読めません",
    "費用対効果を説明したい",
    "来年度予算で",
    "今期中に",
    "まずは小さく試したい",
    "運用に合うかが一番気になる"
  ],
  "ambiguousTerms": [
    "現場に合う",
    "品質改善",
    "連携",
    "導入が大変",
    "効果",
    "予算はある",
    "なるべく早く",
    "現場の反応"
  ],
  "goodQuestions": [
    "現場で一番困っている運用はどこですか？",
    "その課題は品質、納期、工数のどれに一番影響していますか？",
    "現在使っているシステムや運用で、残すもの・置き換えるものは何ですか？",
    "情報システム部や工場長には、何を確認する必要がありますか？",
    "現場の方が不安に感じそうなのは、操作、工数、責任範囲のどれですか？",
    "予算はすでに確保済みですか、それともこれから申請される段階ですか？",
    "いつまでに契約、導入、利用開始できている必要がありますか？",
    "最初に小さく試すなら、どのラインや工程が適していますか？",
    "費用対効果を見るなら、時間削減、品質、リスク低減のどれを重視しますか？",
    "導入にあたって一番懸念されている点は何ですか？"
  ],
  "avoid": [
    "現場利用者と決裁者を混同する",
    "既存システム連携の範囲を技術要件だけで判断する",
    "予算ありを確定予算とみなす",
    "導入障壁を聞いた後に解消条件を確認しない",
    "現場定着や教育を対象外として流す",
    "期限を今期中などの曖昧な表現のまま進める"
  ],
  "completionCriteria": [
    "主要課題と品質・納期・工数への影響が具体化されている",
    "既存システムとの関係と必須連携が整理されている",
    "最終決裁者、推薦者、利用責任者が区別できている",
    "予算の有無、金額感、申請時期が確認できている",
    "契約・導入・利用開始の期限が日付で確認できている",
    "現場定着上の懸念と解消条件が確認できている",
    "小さく試す範囲と成功基準が見えている",
    "次回までの双方の宿題と期限が合意されている"
  ],
  "cardRules": [
    "決裁者・予算・期限のいずれかが未確認なら優先カードとして表示する",
    "連携や既存ツールが出たら対象システムと必須要件確認を促す",
    "現場不安が出たら利用者、教育、運用負荷を確認する",
    "今期中や早めになど曖昧な期限表現が出たら日付確認を促す",
    "他社や比較が出たら競合名・比較軸・決定基準確認を促す",
    "商談終盤では新規深掘りより次アクション確定カードを優先する"
  ]
}
