{
  "id": "recruiting/default",
  "conversationType": "recruiting",
  "industry": "any",
  "title": "採用面談ヒアリング",
  "description": "転職理由、意思決定条件、期待、懸念、時期、評価根拠、不適切質問回避の聞き漏れを減らす。",
  "mustCheck": [
    "転職理由、きっかけ、現職で解決できない理由",
    "意思決定条件、必須条件、優先順位、妥協できる条件",
    "職務要件と候補者経験の対応関係",
    "成果の具体性、役割、行動、結果、再現性",
    "期待している仕事内容、成長、環境、報酬、マネジメント",
    "会社、職種、選考、入社後への懸念",
    "入社可能時期、退職交渉期間、他社選考期限",
    "候補者からの質問と次回までに確認したいこと"
  ],
  "signals": [
    "転職理由に具体的な出来事や時期がある",
    "不満だけでなく次に実現したい状態を語れる",
    "意思決定条件に順位がついている",
    "懸念が抽象的なまま残っている",
    "入社時期が日付または月単位で明確",
    "他社オファーや面接期限がある",
    "STAR形式で具体例を説明できる",
    "自分の担当範囲とチーム成果を分けて話せる",
    "成果指標や改善幅を数値で示せる",
    "志望理由が職務内容と接続している",
    "質問への回答が一貫しない",
    "評価に関係ない個人情報へ話題が流れている"
  ],
  "ambiguousTerms": [
    "成長",
    "裁量",
    "カルチャー",
    "やりがい",
    "柔軟な働き方",
    "コミュニケーション力",
    "主体性",
    "即戦力"
  ],
  "goodQuestions": [
    "今回転職を考え始めた一番のきっかけは何ですか？",
    "現職に残る場合、何が変われば転職しなくてもよいですか？",
    "次の会社選びで絶対に外せない条件を3つ挙げると何ですか？",
    "その条件に優先順位をつけるとどうなりますか？",
    "直近で最も職務に近い経験について、状況、あなたの役割、行動、結果を教えてください。",
    "その成果の中で、あなたが直接担った範囲はどこですか？",
    "難しい判断をした場面で、何を基準に決めましたか？",
    "入社前に解消しておきたい不安はありますか？",
    "希望入社時期と、そこから逆算した意思決定期限はいつですか？",
    "選考や職務内容について、現時点で不明点や懸念はありますか？"
  ],
  "avoid": [
    "転職理由を不満だけで処理して次に求める状態を聞かない",
    "希望条件を聞くだけで優先順位を確認しない",
    "印象語だけで評価を記録する",
    "年齢、生年月日、家族構成、婚姻、妊娠、出産予定に関する質問",
    "本籍、出生地、国籍、民族、宗教、信条、支持政党に関する質問",
    "健康状態、障害、病歴などを職務要件と無関係に尋ねる質問"
  ],
  "completionCriteria": [
    "転職理由が背景、きっかけ、現職で解決困難な理由まで説明されている",
    "意思決定条件が必須条件と優先順位で整理されている",
    "必須要件ごとに根拠となる発言が記録されている",
    "評価は事実、発言、行動例に基づいている",
    "期待と求人内容の一致点・ずれが確認されている",
    "懸念と解消に必要な情報が明確になっている",
    "入社可能時期と意思決定期限が日付または月単位で確認されている",
    "違法・不適切質問をしていない"
  ],
  "cardRules": [
    "1カード1論点に分ける",
    "抽象語が出たら具体例、優先順位、判断基準を追質問する",
    "転職理由は過去の不満と未来の期待をセットで扱う",
    "評価カードには根拠発言または具体事例を1つ以上紐づける",
    "評価対象外の個人情報は記録しない",
    "未確認項目は低評価ではなく確認待ちとして扱う"
  ]
}
