{
  "id": "requirements/default",
  "conversationType": "requirements",
  "industry": "any",
  "title": "要件定義ヒアリング",
  "description": "MVP範囲、業務フロー、権限、データ、例外、運用、受け入れ条件の聞き漏れを減らす。",
  "mustCheck": [
    "MVPで必ず成立させる業務成果と対象外範囲",
    "現行の業務フロー、関係者、手作業、判断ポイント",
    "ロールごとの権限、承認、閲覧・編集・削除の境界",
    "保存対象データ、保存場所、保存期間、削除・復元・暗号化",
    "通常フロー以外の例外、差し戻し、キャンセル、期限超過、重複",
    "外部連携、認証方式、同期方向、失敗時の再試行",
    "成功指標、受入条件、業務上の完了判定",
    "検証方法、必要なテストデータ、完了判定の証跡"
  ],
  "signals": [
    "MVPと言いながら複数部署の例外要件が多い",
    "現行業務の説明が人によって異なる",
    "承認者や責任者が曖昧",
    "閲覧制限や編集制限の話が後回しになっている",
    "データの正本が複数存在する",
    "例外時は担当者が判断する",
    "履歴を残す",
    "削除できるようにする",
    "外部ツールと連携する",
    "失敗したら通知する",
    "いい感じに",
    "成功条件がエラーにならないだけ"
  ],
  "ambiguousTerms": [
    "完了",
    "承認",
    "担当者",
    "管理者",
    "保存",
    "連携",
    "リアルタイム",
    "適切"
  ],
  "goodQuestions": [
    "MVPで最初に業務上達成できていないと困ることは何ですか？",
    "この業務は誰が開始し、誰が何を確認したら終わりますか？",
    "現行フローを1件の実例で、開始から完了まで順に説明できますか？",
    "各ロールは、作成・閲覧・更新・削除・承認・代理操作のどれを実行できますか？",
    "保存するデータと保存しないデータを具体的に分けるとどうなりますか？",
    "通常ケース以外で最も頻度が高い例外と、最も影響が大きい例外は何ですか？",
    "正本データはどこにあり、他システムとの不整合が起きた場合は何を優先しますか？",
    "外部連携が失敗した場合、ユーザーには何を見せ、システムは何回・いつ再試行しますか？",
    "この仕様が金額、PDF、CSV、KPI、認可、締め済みデータに影響しますか？",
    "受け入れ確認に必要なテストデータは何ですか？"
  ],
  "avoid": [
    "MVPに将来要望を混ぜて合意する",
    "画面項目だけを聞いて業務判断を確認しない",
    "正常系だけで要件確定する",
    "管理者という言葉だけで権限をまとめる",
    "外部連携の成功ケースだけで要件を閉じる",
    "曖昧な言葉を実装者の推測で補完する"
  ],
  "completionCriteria": [
    "MVP範囲と対象外範囲が明文化されている",
    "通常業務フローが開始条件、分岐、終了条件つきで説明できる",
    "主要ロールごとの権限表が作成できる",
    "保存対象、保存場所、保存期間、削除・復元方針が決まっている",
    "主要な例外ケースと対応方針が整理されている",
    "外部連携ごとの認証、同期方向、失敗時動作が定義されている",
    "受入条件が業務成果ベースかつ観察可能に定義されている",
    "未決事項、保留事項、次回確認者が明確である"
  ],
  "cardRules": [
    "1カード1論点に分け、MVP、業務フロー、権限、例外、データ、運用の分類を付ける",
    "権限が登場したらロール・操作・対象データ・承認者を分解する",
    "保存が登場したら保存期間・削除・復元・暗号化を確認する",
    "外部連携が登場したら失敗時・再試行・手動復旧を確認する",
    "曖昧語が出たら定義、対象ロール、状態遷移、責任者を確認する",
    "QA観点は正常系だけでなく失敗、境界、権限を最低1つ含める"
  ]
}
